{"attempt_id":"attempt_003","step_id":"S17-0","track_id":null,"kind":"recovery","started_at":"2026-08-29T12:24:22+08:00","ended_at":"2026-08-29T12:38:37+08:00","state":"COMPLETED","config_sha256":null,"data_manifest_sha256":"db8673822062534e58060c711116bfed7bdf552c3cbd7c1c7ca13ca25d594f95","source_sha256":null,"scientific_result_eligible":false,"failure_reason":null,"artifact_dir":"artifacts/phase17/s0_audit/resource_profile"}
